language;question;answer
tha_Thai;โจทย์: มีคอมพิวเตอร์เก้าเครื่องในห้องเซิร์ฟเวอร์ โดยตั้งแต่วันจันทร์ถึงวันพฤหัสบดีมีคอมพิวเตอร์ติดตั้งเพิ่มอีกวันละห้าเครื่อง ตอนนี้มีคอมพิวเตอร์ในห้องเซิร์ฟเวอร์กี่เครื่อง;คำตอบทีละขั้นตอน: ตั้งแต่วันจันทร์ถึงวันพฤหัสบดีรวมกันเป็น 4 วัน โดยแต่ละวันเพิ่มคอมพิวเตอร์ไป 5 เครื่อง แสดงว่าเพิ่มคอมพิวเตอร์ไปทั้งหมด 4 * 5 = 20 เครื่อง แรกเริ่มมีคอมพิวเตอร์อยู่ 9 เครื่อง ดังนั้น ตอนนี้จะมีคอมพิวเตอร์อยู่ 9 + 20 = 29 เครื่อง คำตอบคือ 29
tha_Thai;โจทย์: ลีอามีช็อกโกแลตอยู่ 32 ชิ้น และน้องสาวมีช็อกโกแลตอยู่ 42 ชิ้น หากทั้งสองคนทานช็อกโกแลตไปแล้ว 35 ชิ้น จะเหลือช็อกโกแลตทั้งหมดกี่ชิ้น;คำตอบทีละขั้นตอน: ลีอามีช็อกโกแลตอยู่ 32 ชิ้น และน้องสาวมีช็อกโกแลตอยู่ 42 ชิ้น แสดงว่าเดิมมีช็อกโกแลตอยู่ 32 + 42 = 74 ชิ้น หากทานไปแล้ว 35 ชิ้น ดังนั้นจะเหลือช็อกโกแลตทั้งหมดอยู่ 74 - 35 = 39 ชิ้น คำตอบคือ 39
tha_Thai;โจทย์: ชอว์นมีของเล่นห้าชิ้น ในวันคริสต์มาส เขาได้รับของเล่นจากแม่และพ่อคนละสองชิ้น ตอนนี้ชอว์นมีของเล่นกี่ชิ้น;คำตอบทีละขั้นตอน: ชอว์นมีของเล่น 5 ชิ้น เขาได้รับของเล่นจากแม่ 2 ชิ้น แสดงว่าตอนนี้ชอว์นมีของเล่นอยู่ 5 + 2 = 7 ชิ้น แล้วเขาก็ได้รับของเล่นจากพ่อเพิ่มอีก 2 ชิ้น ดังนั้น ชอว์นจึงมีของเล่นรวมทั้งหมด 7 + 2 = 9 ชิ้น คำตอบคือ 9
tha_Thai;โจทย์: ไมเคิลมีลูกกอล์ฟ 58 ลูก ในวันอังคาร เขาทำลูกกอล์ฟหายไป 23 ลูก, ในวันพุธ เขาทำหายอีก 2 ลูก, สิ้นสุดวันพุธ ไมเคิลมีลูกกอล์ฟกี่ลูก;คำตอบทีละขั้นตอน: แรกเริ่ม ไมเคิลมีลูกกอล์ฟอยู่ 58 ลูกและทำหายไป 23 ลูก แสดงว่าเขาเหลือลูกกอล์ฟอยู่ 58 - 23 = 35 ลูก หลังจากนั้นเขาทำหายอีก 2 ลูก ดังนั้น ตอนนี้เขาจึงมีลูกกอล์ฟอยู่ 35 - 2 = 33 ลูก คำตอบคือ 33
tha_Thai;โจทย์: โอลิเวียมีเงินอยู่ $23 เธอซื้อขนมปังเบเกิลไปห้าชิ้น ราคาชิ้นละ $3 โอลิเวียเหลือเงินอยู่เท่าไร;คำตอบทีละขั้นตอน: ขนมปังเบเกิล 5 ชิ้น ราคาชิ้นละ $3 รวมเป็นเงิน 5 * 3 = 15 ดอลลาร์ แรกเริ่มโอลิเวียมีเงินอยู่ $23 ดังนั้น ตอนนี้โอลิเวียจะเหลือเงินอยู่ 23 - 15 = 8 ดอลลาร์ คำตอบคือ 8
tha_Thai;โจทย์: เจสันมีลูกอมโลลิป๊อป 20 แท่ง เขาให้แดนนี่ไปจำนวนหนึ่งจนตอนนี้เหลือลูกอมโลลิป๊อปอยู่ 12 แท่ง เจสันให้ลูกอมโลลิป๊อปกับแดนนี่ไปกี่แท่ง;คำตอบทีละขั้นตอน: แรกเริ่มเจสันมีลูกอมโลลิป๊อปอยู่ 20 แท่ง แต่ตอนนี้เขาเหลือลูกอมโลลิป๊อปอยู่เพียง 12 แท่ง ดังนั้น เจสันให้ลูกอมโลลิป๊อปแดนนี่ไป 20 - 12 = 8 แท่ง คำตอบคือ 8
tha_Thai;โจทย์: หากที่จอดรถมีรถยนต์จอดอยู่ 3 คัน และมีรถยนต์ที่เพิ่งขับมาถึงอีก 2 คัน ที่จอดรถมีรถยนต์กี่คัน;คำตอบทีละขั้นตอน: แรกเริ่มมีรถยนต์อยู่ 3 คัน ขับมาถึงที่จอดรถอีก 2 คัน ดังนั้น จะมีรถยนต์รวมกันเป็น 3 + 2 = 5 คัน คำตอบคือ 5
jap_Japn;問題：ロジャーは5個のテニスボールがあります。テニスボールの缶を2つ追加で買います。それぞれの缶には3つのテニスボールが入っています。彼は今いくつのテニスボールがありますか？;ステップごとの答え：ロジャーは最初5個のボールがありました。テニスボール3個入りの缶が2つあれば、テニスボールは6個あります。5+6=11。答えは11です。
jap_Japn;問題：サーバールームには9台のコンピューターがありました。月曜日から木曜日まで毎日5台のコンピューターをインストールしました。今サーバールームには難題のコンピューターがありますか？;ステップごとの答え：月曜から木曜まで4日あります。毎日5台のコンピューターが追加されます。つまり、全部で4*5=20台のコンピューターが追加されました。最初に9台のコンピューターがあったので、今は9+20=29台のコンピューターとなります。答えは29です。
jap_Japn;問題：リアは32個のチョコレートを持っていました、彼女の妹は42個持っていました。彼女達が35個食べたとしたら、全部で何個残っていますか？;ステップごとの答え：リアは32個のチョコレートを持っており、リアの妹は42個持っていた。つまり、元々32+42=74個のチョコレートがあった。35個が食べられた。だから全部で、彼女たちには74-35=39個のチョコレートが残っている。答えは39個。
jap_Japn;問題：ショーンは5個のおもちゃを持っています。クリスマスに、彼は父と母からそれぞれ2つずつおもちゃをもらいました。今彼はいくつのおもちゃがありますか？;ステップごとの答え：彼は5個おもちゃを持っています。母から2つもらった後は、5+2=7個のおもちゃがあります。その後父から2つさらにもらい、全部で彼は、7+2=9個のおもちゃがあります。答えは9個です。
jap_Japn;"問題：マイケルは58個のゴルフボールを持っています。火曜日、彼は
23個のゴルフボールを失くしました。水曜日、さらに2個失くしました。水曜日の終わりには、彼は何このゴルフボールを持っていましたか？";ステップごとの答え：マイケルは最初58個のゴルフボールがあり、23個なくしました、だから彼は58-23=35個残っています。彼があと2個なくした後、彼は今35-2=33個残っています。答えは33個です。
jap_Japn;問題：オリビアには$23あります。彼女はそれぞれ$3のベーグルを5つ買いました。彼女にはいくらのお金が残っていますか？;ステップごとの答え：$3のベーグルは5個で、5*3=15ドルになるはずです。オリビアは最初$23あったので、今彼女には23-15=8ドル残っています。答えは8です。
jap_Japn;問題：ジェイソンは20個の飴を持っています。彼はデニーに飴をいくつかあげました。今、ジェイソンには12個の飴があります。ジェイソンはデニーにいくつ飴をあげましたか？;ステップごとの答え：ジェイソンには最初20個の飴がありましたが、今彼は12個しか持っていません、なので彼はデニーに、20-12=8個の飴をあげました。答えは8です。
jap_Japn;問題：駐車場に3台の車があり、2台の車が到着するとしたら、駐車場には何台の車がありますか？;ステップごとの答え：最初に3台の車があり、さらに2台到着したので、今は3+2で5台の車があるはずです。答えは5です。
zho_Hant;问题：罗杰有 5 个网球。他又买了 2 罐网球。每罐有 3 个网球。他现在有多少个网球？;逐步解答：罗杰一开始有 5 个球。2 罐各 3 个网球就是 6 个网球。5 + 6 = 11。答案是 11。
zho_Hant;问题：服务器机房里有九台电脑。从周一到周四，每天又安装了五台电脑。服务器机房里现在有多少台电脑？;逐步解答：从周一到周四有 4 天。每天增加 5 台电脑。这意味着一共增加了 4 * 5 = 20 台电脑。一开始有 9 台电脑，所以现在有 9 + 20 = 29 台电脑。答案是 29。
zho_Hant;问题：利亚有 32 块巧克力，她妹妹有 42 块。如果她们吃了 35 块，她们一共还剩下多少块？;逐步解答：利亚有 32 块巧克力，利亚的妹妹有 42 块。这意味着原来有 32 + 42 = 74 块巧克力。35 块被吃掉了。所以她们一共还有 74 - 35 = 39 块巧克力。答案是 39。
zho_Hant;问题：肖恩有五个玩具。圣诞节他从他爸爸妈妈那里各得到了两个玩具。他现在有多少个玩具？;逐步解答：他有 5 个玩具。他从妈妈那里得到 2 个，所以之后他有 5 + 2 = 7 个玩具。然后他又从爸爸那里得到了 2 个，所以他一共有 7 + 2 = 9 个玩具。答案是 9。
zho_Hant;问题：迈克尔有 58 个高尔夫球。周二，他丢失了 23 个高尔夫球。周三，他又丢失了 2 个。周三结束时他有多少个高尔夫球？;逐步解答：迈克尔一开始有 58 个高尔夫球，丢失了 23 个，所以他有 58 - 23 = 35 个。在他又丢失了 2 个后，他现在有 35 - 2 = 33 个球。答案是 33。
zho_Hant;问题：奥利维亚有 23 美元。她买了五个单价 3 美元的百吉饼。她还剩多少钱？;逐步解答：5 个单价 3 美元的百吉饼应该花费 5 * 3 = 15 美元。奥利维亚一开始有 23 美元，所以现在她还剩 23 - 15 = 8 美元。答案是 8。
zho_Hant;问题：杰森有 20 根棒棒糖。他给了丹尼一些棒棒糖。现在杰森有 12 根棒棒糖。杰森给了丹尼多少根棒棒糖？;逐步解答：杰森一开始有 20 根棒棒糖，但现在他只有 12 根了，所以他给了丹尼 20 - 12 = 8 根棒棒糖。答案是 8。
zho_Hant;问题：如果停车场里有 3 辆车，又来了 2 辆车，停车场里有多少辆车？;逐步解答：一开始有 3 辆车，又来了 2 辆，所以现在应该有 3 + 2 = 5 辆车。答案是 5。
rus_Cyrl;Задача: у Роджера 5 теннисных мячей. Он покупает еще 2 банки теннисных мячей. В каждой банке 3 теннисных мяча. Сколько теннисных мячей у него сейчас?;Пошаговое решение: в начале у Роджера было 5 мячей. 2 банки по 3 теннисных мяча каждая — это 6 теннисных мячей. 5 + 6 = 11. Ответ — 11.
rus_Cyrl;Задача: в серверной было девять компьютеров. Каждый день с понедельника по четверг устанавливалось еще по пять компьютеров. Сколько компьютеров сейчас в серверной?компьютеров.;Пошаговое решение: с понедельника по четверг прошло 4 дня. Каждый день добавляли по 5 компьютеров. То есть всего добавили 4 * 5 = 20 компьютеров. Вначале было 9 компьютеров, значит, теперь стало 9 + 20 = 29 компьютеров. Ответ — 29.
rus_Cyrl;Задача: у Лии было 32 шоколадных конфеты, а у ее сестры — 42. Если 35 они съели, сколько всего штук у них осталось?;Пошаговое решение: у Лии было 32 шоколадных конфеты, а у сестры Лии — 42. Значит, первоначально было 32 + 42 = 74 шоколадных конфеты. 35 съели. Значит, всего осталось 74 - 35 = 39 шоколадных конфет. Ответ — 39.
rus_Cyrl;Задача: у Шона было пять игрушек. На Рождество он получил по две игрушки от мамы и от папы. Сколько у него сейчас игрушек?;Пошаговое решение: у него было 5 игрушек. Он получил 2 от мамы, и после этого у него стало 5 + 2 = 7 игрушек. Потом он получил еще 2 от папы, так что в общей сложности у него стало 7 + 2 = 9 игрушек. Ответ — 9.
rus_Cyrl;Задача: у Майкла было 58 мячей для гольфа. Во вторник он потерял 23 мяча для гольфа. В среду он потерял еще 2. Сколько мячей для гольфа осталось у него к концу среды?;Пошаговое решение: вначале у Майкла было 58 мячей для гольфа, 23 он потерял, и у него осталось 58 - 23 = 35. После этого он потерял еще 2, и теперь у него осталось 35 - 2 = 33 мяча. Ответ — 33.
rus_Cyrl;Задача: у Оливии было 23 $. Она купила пять рогаликов по 3 $. Сколько денег у нее осталось?;Пошаговое решение: 5 рогаликов по 3 $ стоят 5 * 3 = 15 долларов. Вначале у Оливии было 23 $, значит, теперь у нее осталось 23 - 15 = 8 $. Ответ — 8.
rus_Cyrl;Задача: у Джейсона было 20 леденцов. Он дал несколько леденцов Дэнни. Теперь у Джейсона осталось 12 леденцов. Сколько леденцов Джейсон дал Дэнни?;Пошаговое решение: вначале у Джейсона было 20 леденцов, а теперь осталось только 12, значит, он дал Дэнни 20 - 12 = 8 леденцов. Ответ — 8.
rus_Cyrl;Задача: если на парковке 3 автомобиля и подъезжают еще 2, сколько автомобилей на парковке?;Пошаговое решение: вначале есть 3 автомобиля, подъезжают еще 2, значит, теперь там должно быть 3 + 2 = 5 автомобилей. Ответ — 5.
swa_Latn;Swali: Roger ana mipira 5 ya tenisi. Ananunua mikebe 2 zaidi ya mipira ya tenisi. Kila mkebe una mipira 3 ya tenisi. Ana mipira mingapi ya tenisi kwa sasa?;Jibu la Hatua kwa Hatua: Roger alianza kwa mipira 5. Mikebe 2 yenye mipira 3 ya tenisi kila oja ni mipira 6 ya tenisi. 5 + 6 = 11. Jibu ni 11.
swa_Latn;Swali: Kuna kompyuta tisa katika chumba cha seva. Kompyuta tano zaidi zilisakinishwa kila siku, kuanzia Jumatatu hadi Alhamisi. Kuna kompyuta ngapi wkenye chumba cha seva kufikia sasa?;Jibu la Hatua kwa Hatua: Kuna siku 4 kuanzia Jumatatu mpaka Alhamisi. Kompyuta 5 ziliongezwa kila siku. Hiyo inamaanisha kuwa kwa jumla kompyuta 4 * 5 = 20 ziliongezwa. Kulikuwa na kompyuta 9 mwanzoni, hivyo sasa kuna kompyuta 9 + 20 = 29. Jibu ni 29.
swa_Latn;Swali: Leah alikuwa na chokoleti 32 na dadake alikuwa na 42. Iwapo walikula 35, wamesalia na chokoleti ngapi kwa jumla?;Jibu la Hatua kwa Hatua: Lea alikuwa na chokoleti 32 na dadake Leah alikuwa na 42. Hiyo inamaanisha kuwa awali kulikuwa na chokoleti 32 + 42 + 74. 35 zimeliwa. Hivyo kwa jumla bado kuna chokoleti 74 - 35 = 39. Jibu ni 39.
swa_Latn;Swali: Shawn ana wanasesere watano. Siku ya Krismasi, alipata wanasesere wawili kutoka kwa mamake na babake kila mmoja. Sasa ana wanasesere wangapi kwa sasa?;Jibu la Hatua kwa Hatua: Ana wanasesere 5. Alipata 2 kutoka kwa mama, hivyo baada ya hapo alikuwa na wanasesere 5 + 2 = 7. Kisha alipata 2 zaidi kutoka kwa baba, hivyo kwa jumla alikuwa na wanasesere 7 + 2 = 9. Jibu ni 9.
swa_Latn;Swali: Michael alikuwa na mipira 58 ya gofu. Jumanne, alipoteza mipira 23 ya gofu. Jumatano, alipoteza mipira 2 zaidi. Alikuwa na mipira mingapi ya gofu kufikia mwishoni mwa Jumatano?;Jibu la Hatua kwa Hatua: Michael alianza na mipira 58 ya gofu na akapoteza 23, hivyo ana 58 - 23 = 35. Baadaye alipoteza 2 zaidi, sasa ana mipira 35 - 2 = 33. Jibu ni 33.
swa_Latn;Swali: Olivia ana $23. Alinunua bageli tano kwa $3 kila moja. Amesalia na pesa ngapi?;Jibu la Hatua kwa Hatua: Bageli 5 za $3 kila moja zinafaa kugharimu 5 * 3 = dola 15. Olivia alikuwa na $23 mwanzoni, sasa amesalia na dola 23 - 15 = 8. Jibu ni 8.
swa_Latn;Swali: Jason alikuwa na pipi 20. Alimpa Denny pipi nyingine, Sasa Jason amesalia na pipi 12. Jason alimpa Denny pipi ngapi?;Jibu la Hatua kwa Hatua: Jason alianza na pipi 20, lakini sasa ana 12, hivyo alimpa Denny pipi 20 - 12 = 8. Jibu ni 8.
swa_Latn;Swali: Ikiwa kuna magari 3 katika eneo la maegesho na magari 2 zaidi yameongezeka, kuna magari mangapi kwa jumla katika eneo la maegesho?;Jibu la Hatua kwa Hatua: Mwanzoni kuna magari 3, 2 zaidi yameongezeka hivyo kutakuwa na magari 3 + 2 = 5. Jibu ni 5.
